{
  "$schema": "http://json-schema.org/draft-07/schema#",
  "$id": "https://github.com/soyleremo3/monopoly-champion-agent/logs/experiments/schema.json",
  "title": "Monopoly Champion Agent - Experiment Log Entry",
  "description": "One JSON file per meaningful training/benchmark/reproducibility/A-B/replay run. See logs/experiments/README.md for the standard. Unknown values use null, never a guess.",
  "type": "object",
  "additionalProperties": false,
  "required": [
    "experiment_id",
    "experiment_name",
    "experiment_type",
    "date",
    "code_commit_sha",
    "reference_submodule_sha",
    "exact_commands",
    "seeds",
    "algorithm_config",
    "model_checkpoint",
    "counts",
    "runtime",
    "metrics",
    "loss",
    "integrity",
    "result",
    "raw_logs"
  ],
  "properties": {
    "experiment_id": {
      "type": "string",
      "pattern": "^[0-9]{3}-[a-z0-9]+(-[a-z0-9]+)*$",
      "description": "Zero-padded sequence number + kebab-case slug, matches the filename without .json, e.g. 001-fixed-agent-engine-smoke."
    },
    "experiment_name": {
      "type": "string",
      "minLength": 1
    },
    "experiment_type": {
      "type": "string",
      "enum": [
        "engine_smoke",
        "training_smoke",
        "reproducibility_check",
        "training_run",
        "paired_evaluation",
        "benchmark",
        "compatibility_check",
        "inference_smoke",
        "performance_measurement",
        "selfplay_training_smoke"
      ]
    },
    "date": {
      "type": "string",
      "pattern": "^[0-9]{4}-[0-9]{2}-[0-9]{2}$"
    },
    "code_commit_sha": {
      "type": ["string", "null"],
      "pattern": "^[0-9a-f]{7,40}$",
      "description": "Full SHA of the commit that recorded this experiment's results in this repo. null only if genuinely unknown."
    },
    "reference_submodule_sha": {
      "type": ["string", "null"],
      "pattern": "^[0-9a-f]{7,40}$",
      "description": "Pinned references/DeepRL_Monopoly commit SHA at the time of the run."
    },
    "exact_commands": {
      "type": "array",
      "items": {"type": "string", "minLength": 1},
      "minItems": 1,
      "description": "Exact shell command(s) run, in order, including required env vars (e.g. PYTHONHASHSEED=0)."
    },
    "seeds": {
      "type": ["array", "null"],
      "items": {"type": ["integer", "string"]}
    },
    "algorithm_config": {
      "type": "object",
      "description": "Free-form: algorithm name, hyperparameters, opponent pool, engine ruleset id, etc. Use null for individual unknown values, not for the whole object."
    },
    "model_checkpoint": {
      "type": "object",
      "additionalProperties": false,
      "required": ["sha256", "path", "format_version"],
      "properties": {
        "sha256": {"type": ["string", "null"], "pattern": "^[0-9a-f]{64}$"},
        "path": {"type": ["string", "null"]},
        "format_version": {"type": ["integer", "string", "null"]}
      }
    },
    "counts": {
      "type": "object",
      "description": "Free-form: games, rounds, decisions, positions/samples, updates, etc., whichever apply. Use null for values that don't apply to this experiment type."
    },
    "runtime": {
      "type": "object",
      "additionalProperties": false,
      "required": ["wall_time_s", "peak_rss_gib"],
      "properties": {
        "wall_time_s": {"type": ["number", "null"]},
        "peak_rss_gib": {"type": ["number", "null"]}
      }
    },
    "metrics": {
      "type": ["object", "null"],
      "description": "Win/loss counts, win rates, Wilson intervals, net worth, round-cap rate, or other important result metrics. null if this experiment produced none."
    },
    "loss": {
      "type": ["object", "null"],
      "description": "Training loss figures (e.g. loss, policy_loss, value_loss, gradient_norm). null if this experiment recorded no loss (e.g. a pure evaluation run) or the reference's own logging doesn't expose one."
    },
    "integrity": {
      "type": "object",
      "additionalProperties": false,
      "required": ["illegal_actions", "fallbacks", "crashes"],
      "properties": {
        "illegal_actions": {"type": ["integer", "null"]},
        "fallbacks": {"type": ["integer", "null"]},
        "crashes": {"type": ["integer", "null"]}
      }
    },
    "result": {
      "type": "string",
      "minLength": 1,
      "description": "One-paragraph conclusion. Must not claim improvement/strength without statistical support (see docs/EXPERIMENTS.md for the paired-eval discipline this project uses)."
    },
    "raw_logs": {
      "type": ["array", "null"],
      "items": {"type": ["string", "null"]},
      "description": "Repo-relative paths to raw stdout/stderr/output artifacts for this run, if any exist and are small enough to commit. null or [] if none."
    },
    "notes": {
      "type": "string",
      "description": "Optional free-text caveats, corrections, or context that don't fit another field."
    }
  }
}
