{
  "experiment_id": "009-monopolyzero-puct-sim-runtime",
  "experiment_name": "Max-N PUCT runtime at 4/16/32 simulations on an identical state",
  "experiment_type": "performance_measurement",
  "date": "2026-08-11",
  "code_commit_sha": null,
  "reference_submodule_sha": "afd9205761317e196d77f679921c35fb04c7ab96",
  "exact_commands": [
    "PYTHONHASHSEED=0 PYTHONIOENCODING=utf-8 python scripts/monopolyzero_sim_runtime.py"
  ],
  "seeds": [
    23,
    101
  ],
  "algorithm_config": {
    "component": "MaxNPUCT via scripts/monopolyzero_sim_runtime.py (reuses monopoly_bench.cli.smoke()'s exact state-construction code)",
    "simulations_measured": [
      4,
      16,
      32
    ],
    "max_depth": 16,
    "asu_involved": false
  },
  "model_checkpoint": {
    "sha256": "1c825dcdd2c8d83651bd21100024ab2d0b8ce2ba276d701dceb3599536f615cb",
    "path": "references/DeepRL_Monopoly/artifacts/ppo_plus/ppo_hybrid_2000_v2.pt",
    "format_version": 3
  },
  "counts": {
    "decisions_measured": 3,
    "states_used": 1
  },
  "runtime": {
    "wall_time_s": 5.52,
    "peak_rss_gib": null
  },
  "metrics": {
    "latency_s_by_simulations": {
      "4": 0.0694,
      "16": 0.1114,
      "32": 0.2225
    },
    "chosen_action_by_simulations": {
      "4": 1,
      "16": 1,
      "32": 1
    },
    "all_legal": true,
    "scaling": "roughly linear with simulation count"
  },
  "loss": null,
  "integrity": {
    "illegal_actions": 0,
    "fallbacks": null,
    "crashes": 0
  },
  "result": "All three simulation counts (4, 16, 32) returned a legal action from the identical starting state, with latency scaling roughly linearly (0.069s -> 0.111s -> 0.222s), consistent with per-simulation cost being dominated by env clone + forward pass. Same chosen action at every count on this particular state - not a general claim about action-choice sensitivity to simulation count.",
  "raw_logs": [
    "docs/baseline_runs/monopolyzero_sim_runtime.json"
  ],
  "notes": "integrity.fallbacks is null (not applicable, same reasoning as 008 - masked search has no fallback path). peak_rss_gib is null (not separately measured for this run). [2026-08-12 correction: code_commit_sha corrected to null — the clean-tree-before-run discipline did not exist when this ran, so there is no verified clean HEAD SHA at run time. For historical reference, this experiment was recorded in commit b785ff2f924f60dc7f5824e76d81cf91d93f3289.]"
}
