{
  "experiment_id": "013-monopolyzero-strength-pilot-training",
  "experiment_name": "MonopolyZero strength pilot: 32-game ASU-import-free training (CPU, seed 42)",
  "experiment_type": "training_run",
  "date": "2026-08-11",
  "code_commit_sha": "6bda4963f9fb05b0560e0e663d921b36f316a8a3",
  "reference_submodule_sha": "afd9205761317e196d77f679921c35fb04c7ab96",
  "exact_commands": [
    "PYTHONHASHSEED=0 PYTHONIOENCODING=utf-8 python scripts/monopolyzero_strength_train.py"
  ],
  "seeds": [42, 0],
  "algorithm_config": {
    "games_total": 32,
    "opponent_mix": "16 self-play games (model controls all 4 seats) + 16 vs-fixed games (model rotates seats 0-3, 4 times each; fixed-a/b/c fill the other 3 seats)",
    "simulations": 4,
    "max_depth": 16,
    "max_rounds": 50,
    "self_play_for_search_seats": true,
    "batch_size": 64,
    "updates_requested": 100,
    "learning_rate": 0.0003,
    "weight_decay": 0.0001,
    "gradient_clip": 1.0,
    "optimizer_source": "monopoly_bench.config.TrainingConfig defaults (learning_rate/weight_decay/gradient_clip fields only, read directly from the dataclass)",
    "batch_size_and_updates_source": "this project's own pilot-scale choice, not TrainingConfig's frozen-v1 defaults (batch_size=256, updates_per_generation=1000, sized for 32-games-per-generation at full scale, not a one-shot 32-game pilot)",
    "asu_involved": false,
    "seed_note": "seeds=[42, 0]: 42 is GLOBAL_SEED (Python/NumPy/torch RNG seeding + replay-sample RNG); 0 is unused here (reserved for eval's greedy-decoding seed, listed for completeness, not consumed by this script)"
  },
  "model_checkpoint": {
    "sha256": "d00263f4a2ab3cdd73a4d2691bdfae42385292a153996a17198b0074433d0f93",
    "path": "artifacts/monopolyzero_strength_pilot/trained_32games.pt",
    "format_version": 1
  },
  "counts": {
    "games_played": 32,
    "positions_collected_total": 37772,
    "replay_buffer_size_after_append": 37772,
    "updates_completed": 100
  },
  "runtime": {"wall_time_s": 301.55, "peak_rss_gib": 0.6654853820800781},
  "metrics": {
    "baseline_checkpoint_sha256": "22ae2abea60478355f61ce0404a31de3b52fb97769d4f99f7e04f4c673629370",
    "baseline_checkpoint_path": "artifacts/monopolyzero_strength_pilot/baseline_pretraining.pt",
    "trained_checkpoint_sha256": "d00263f4a2ab3cdd73a4d2691bdfae42385292a153996a17198b0074433d0f93",
    "status": "OK"
  },
  "loss": {
    "final_update": {
      "loss": 2.468712329864502,
      "policy_loss": 1.6582667827606201,
      "value_loss": 0.8104456067085266,
      "gradient_norm": 3.1286780834198
    },
    "all_100_updates_finite": true
  },
  "integrity": {"illegal_actions": 0, "fallbacks": 11, "crashes": 0},
  "result": "Training succeeded end to end: 32/32 games completed (0 illegal actions, 0 crashes), 37,772 positions collected, all 100 training updates produced finite losses, both checkpoints (pre-training baseline and post-training trained) saved and hashed. asu_modules_loaded was [] (count 0) at the end of the run, confirmed by the script's own sys.modules guard. Fixed-agent fallbacks: 11 total, all from TheDealMaker in a single vs-fixed game (seed 20013) - not a crash, the compatibility-fallback path working as designed. This is a training-plumbing-at-scale result; whether it produced a measurably different/stronger policy is evaluated separately in 014-monopolyzero-strength-pilot-paired-eval.json, not claimed here.",
  "raw_logs": ["docs/baseline_runs/monopolyzero_strength_train_stdout.txt"],
  "notes": "Checkpoints (artifacts/monopolyzero_strength_pilot/{baseline_pretraining,trained_32games}.pt) are NOT committed, per CLAUDE.md - referenced here by SHA-256 and local path only. Per-game breakdown (32 entries: category, seed, focus_seat, decisions, winner, positions, fallbacks) is in the raw stdout log, not duplicated here."
}
